<?xml version="1.0" encoding="UTF-8"?><resources base="http://" id="materialinformation_Service" name="MaterialinfoController" xmlns="http://www.w3school.com.cn" xmlns:xsi="http://www.w3.org/2001/XMLSchema-instance" xsi:schemaLocation="http://www.w3school.com.cn ../schema/XMLSchema11_24.xsd "><add><resource name="addMaterials" path="addMaterials" id="Material_New"><request><param name="imgTitle1" type="String" attribute="Materialinformation.imgTitle1"></param><param name="imgAuthor1" type="String" attribute="Materialinformation.imgAuthor1"></param><param name="imgDetail1" type="String" attribute="Materialinformation.imgDetail1"></param><param name="CommonsMultipartFile" type="imgFiles" attribute="Materialinformation.CommonsMultipartFile"></param></request><response dataType="JSON"><data name="" type="String"></data></response></resource></add><delete><resource name="deleteMultipleMaterials" path="deleteMultipleMaterials" id="Delete_MultipleMaterials"><request><param name="pictureName" type="String[]" attribute="Materialinformation.pictureName"></param></request><response dataType="JSON"><data name="" type="String"></data></response></resource><resource name="deleteMaterials" path="deleteMaterials" id="Delete_Materials"><request><param name="materialId" type="String" attribute="Materialinformation.materialId"></param></request><response dataType="JSON"><data name="" type="String"></data></response></resource></delete><update><resource name="editMaterialInfo" path="editMaterialInfo" id="UPDATE_MaterialInfo"><request><param name="materialId" type="String" attribute="Materialinformation.materialId"></param><param name="imgTitle1" type="String" attribute="Materialinformation.imgTitle1"></param><param name="imgAuthor1" type="String" attribute="Materialinformation.imgAuthor1"><restriction><enumeration >sdgsdf</enumeration></restriction></param><param name="imgDetail1" type="String" attribute="Materialinformation.imgDetail1"></param><param name="CommonsMultipartFile" type="imgFiles" attribute="Materialinformation.CommonsMultipartFile"></param></request><response dataType="JSON"><data name="" type="String"></data></response></resource></update><find><resource name="displaySellerInfo" path="displaySellerInfo" id="FIND_SellerInfo"><request></request><response dataType="JSON"><data name="" type="String"></data></response></resource><resource id="Materialinformation_Find_Condition" name="searchMaterial" path="searchMaterial"><request><param name="accessState" attribute="Materialinformation.state" type="String"></param><param name="phototype" attribute="Materialinformation.type" type="String"></param><param name="title" attribute="Materialinformation.title" type="String" /><param name="starttime" type="String" attribute="Materialinformation.starttime" /><param name="endtime" type="String" attribute="Materialinformation.endtime" /></request><response dataType="JSON"><data name="" type="String" /></response></resource></find></resources>